{
  "schema_version": "1.0.0",
  "registry_version": "0.1.0",
  "status": "planned_foundation",
  "source_issue": 204,
  "orchestrator_issue": 203,
  "baseline_sha": "ab2ebca1849d2e3ed31ca8922ab74a0215e04939",
  "bundles_ref": "config/compliance/bundles.json",
  "field_defaults": {
    "domain": "compliance",
    "owner_service": "compliance",
    "processing_activity": "governance_catalog",
    "purpose": "accountability_and_schema_governance",
    "legal_basis": "legal_obligation_and_legitimate_interest",
    "sensitivity": "internal_governance_metadata",
    "retention_policy": "governance_record_10y",
    "encryption_policy": "platform_at_rest",
    "masking_policy": "none",
    "access_policy": "compliance_admin_read",
    "sharing_policy": "internal_need_to_know",
    "source_system": "repository_contract",
    "lineage": ["config/compliance/field_registry.json"],
    "disposal_method": "controlled_delete_after_legal_hold",
    "status": "planned",
    "bundle_codes": ["B0", "B1", "B2", "B3", "B4", "B5", "B6", "B7", "B8", "B9", "B10", "B14"]
  },
  "fields": [
    {"field_id": "compliance.field_registry.id", "schema_name": "compliance", "table_name": "field_registry", "field_name": "id", "physical_type": "uuid", "nullable": false},
    {"field_id": "compliance.field_registry.registry_version", "schema_name": "compliance", "table_name": "field_registry", "field_name": "registry_version", "physical_type": "text", "nullable": false},
    {"field_id": "compliance.field_registry.domain", "schema_name": "compliance", "table_name": "field_registry", "field_name": "domain", "physical_type": "text", "nullable": false},
    {"field_id": "compliance.field_registry.owner_service", "schema_name": "compliance", "table_name": "field_registry", "field_name": "owner_service", "physical_type": "text", "nullable": false},
    {"field_id": "compliance.field_registry.schema_name", "schema_name": "compliance", "table_name": "field_registry", "field_name": "schema_name", "physical_type": "text", "nullable": false},
    {"field_id": "compliance.field_registry.table_name", "schema_name": "compliance", "table_name": "field_registry", "field_name": "table_name", "physical_type": "text", "nullable": false},
    {"field_id": "compliance.field_registry.field_name", "schema_name": "compliance", "table_name": "field_registry", "field_name": "field_name", "physical_type": "text", "nullable": false},
    {"field_id": "compliance.field_registry.physical_type", "schema_name": "compliance", "table_name": "field_registry", "field_name": "physical_type", "physical_type": "text", "nullable": false},
    {"field_id": "compliance.field_registry.nullable", "schema_name": "compliance", "table_name": "field_registry", "field_name": "nullable", "physical_type": "boolean", "nullable": false},
    {"field_id": "compliance.field_registry.processing_activity", "schema_name": "compliance", "table_name": "field_registry", "field_name": "processing_activity", "physical_type": "text", "nullable": false},
    {"field_id": "compliance.field_registry.purpose", "schema_name": "compliance", "table_name": "field_registry", "field_name": "purpose", "physical_type": "text", "nullable": false},
    {"field_id": "compliance.field_registry.legal_basis", "schema_name": "compliance", "table_name": "field_registry", "field_name": "legal_basis", "physical_type": "text", "nullable": false},
    {"field_id": "compliance.field_registry.sensitivity", "schema_name": "compliance", "table_name": "field_registry", "field_name": "sensitivity", "physical_type": "text", "nullable": false},
    {"field_id": "compliance.field_registry.retention_policy", "schema_name": "compliance", "table_name": "field_registry", "field_name": "retention_policy", "physical_type": "text", "nullable": false},
    {"field_id": "compliance.field_registry.encryption_policy", "schema_name": "compliance", "table_name": "field_registry", "field_name": "encryption_policy", "physical_type": "text", "nullable": false},
    {"field_id": "compliance.field_registry.masking_policy", "schema_name": "compliance", "table_name": "field_registry", "field_name": "masking_policy", "physical_type": "text", "nullable": false},
    {"field_id": "compliance.field_registry.access_policy", "schema_name": "compliance", "table_name": "field_registry", "field_name": "access_policy", "physical_type": "text", "nullable": false},
    {"field_id": "compliance.field_registry.sharing_policy", "schema_name": "compliance", "table_name": "field_registry", "field_name": "sharing_policy", "physical_type": "text", "nullable": false},
    {"field_id": "compliance.field_registry.source_system", "schema_name": "compliance", "table_name": "field_registry", "field_name": "source_system", "physical_type": "text", "nullable": false},
    {"field_id": "compliance.field_registry.lineage", "schema_name": "compliance", "table_name": "field_registry", "field_name": "lineage", "physical_type": "jsonb", "nullable": false, "json_schema_ref": "config/compliance/schemas/lineage.schema.json", "allow_unregistered_personal_keys": false},
    {"field_id": "compliance.field_registry.disposal_method", "schema_name": "compliance", "table_name": "field_registry", "field_name": "disposal_method", "physical_type": "text", "nullable": false},
    {"field_id": "compliance.field_registry.status", "schema_name": "compliance", "table_name": "field_registry", "field_name": "status", "physical_type": "text", "nullable": false},
    {"field_id": "compliance.field_registry.effective_from", "schema_name": "compliance", "table_name": "field_registry", "field_name": "effective_from", "physical_type": "date", "nullable": false},
    {"field_id": "compliance.field_registry.supersedes_field_id", "schema_name": "compliance", "table_name": "field_registry", "field_name": "supersedes_field_id", "physical_type": "uuid", "nullable": true},
    {"field_id": "compliance.field_registry.created_at", "schema_name": "compliance", "table_name": "field_registry", "field_name": "created_at", "physical_type": "timestamptz", "nullable": false},
    {"field_id": "compliance.field_registry.updated_at", "schema_name": "compliance", "table_name": "field_registry", "field_name": "updated_at", "physical_type": "timestamptz", "nullable": false}
  ]
}
